{
  "services": {
    "45018000000110085": {
      "service": {
        "alias": "asLbTest",
        "id": 45018000000110085,
        "type": "AUTOSCALER",
        "version": "1.0",
        "state": "FAILED",
        "targetState": "START",
        "resolver": 45018000000030107,
        "secondaryState": "",
        "description": {
          "template": [{
            "cloud": "dockerCloud",
            "type": "CONTAINER",
            "image": "dzhangmsx/sort",
            "subnetid": "UARS:K744:E3MN:3SFB:SP5L:WOHM:H2NH:H2GL:RF7K:JHR5:FE4N:KCRX/172.17.0.0:f27415300eac508ce0a4ebf56a1f84df883722f925c8dd5c999a85a66bf8deb8",
            "prefix": "lb",
            "cpu": 1,
            "memory": 128,
            "disk": 0
          }],
          "load_balance": true,
          "policy": [{
            "name": "policy1",
            "min": 2,
            "max": 10,
            "scheduler_policy": "basic",
            "monitor": [{
              "name": "cpu_util",
              "scale_in_threshold": 2,
              "scale_out_threshold": 5,
              "scale_in_unit": 2,
              "scale_out_unit": 2
            }]
          }]
        },
        "implementation": {
          "Error": "Invalid target state: START. Resolution denied by the resolver."
        },
        "decomposition": []
      },
      "yaml": "service:\n  alias: asLbTest\n  id: 45018000000110085\n  type: AUTOSCALER\n  version: '1.0'\n  state: FAILED\n  targetState: START\n  resolver: 45018000000030107\n  secondaryState: ''\n  description:\n    template:\n    - cloud: dockerCloud\n      type: CONTAINER\n      image: dzhangmsx/sort\n      subnetid: UARS:K744:E3MN:3SFB:SP5L:WOHM:H2NH:H2GL:RF7K:JHR5:FE4N:KCRX/172.17.0.0:f27415300eac508ce0a4ebf56a1f84df883722f925c8dd5c999a85a66bf8deb8\n      prefix: lb\n      cpu: 1\n      memory: 128\n      disk: 0\n    load_balance: true\n    policy:\n    - name: policy1\n      min: 2\n      max: 10\n      scheduler_policy: basic\n      monitor:\n      - name: cpu_util\n        scale_in_threshold: 2\n        scale_out_threshold: 5\n        scale_in_unit: 2\n        scale_out_unit: 2\n  implementation:\n    Error: 'Invalid target state: START. Resolution denied by the resolver.'\n  decomposition: []\n"
    }
  },
  "message": "Service extracted.",
  "status": "pass"
}